99;1;"Conjunto mueble de baño Royo Vitale";"13";863.0;1;"";1;181.17;17.35;"";"";"";"";"Royo Group";"Royo Group";"8414623357571";"";"";"";"120.0";"56.5";"46.0";0;"Entre 3 y 5 días";"";0;1;"";0;"both";"";"";"";"120 cm con 4 cajones, suspedido y lavabo doble poza Enzo de cerámica";"<p>¿Necesitas un gran mueble de baño con mucho espacio de almacenamiento? Y sin renunciar al diseño y la innovación, claro.</p><p> </p><p dir=ltr>Pues el conjunto de <strong>mueble de baño suspendido</strong> Vitale se encarga de todo.</p><p> </p><p dir=ltr>Royo pone tecnología y diseño. Tú preocúpate de decorar.</p><p> </p><p dir=ltr>El <strong>lavabo </strong>Enzo es blanco brillante, ¿cómo lo combinarás? Para el mueble elige entre los colores blanco brillante, <em>fumé </em>mate o el recubrimiento 3D en blanco <em>nature</em>, <em>beige nature</em> o gris <em>nature</em>. Profundidad del seno 12.5 cm y espesor 2 cm.</p><p> </p><p dir=ltr>El originalísimo <strong>espejo Murano u opcional Longo </strong>viene con con aplique de luz Lucce de 30 cm con 5700 k 8W y 987 LM. ¿Te lo vas a perder?</p><p> </p><p dir=ltr>Con <strong>cuatro cajones</strong> en un mueble de baño de 120 cm de ancho, 56,5 cm de alto y 46 de fondo no te va a faltar espacio.</p><p> </p><p dir=ltr>El sistema Indaux permite la <strong>extracción total </strong>de estos cajones con tirador integrado, para que todo esté a mano.</p><p> </p><p dir=ltr>Y lo estará, no lo dudes: ordenado y clasificado gracias a la <strong>bandeja organizadora</strong> en su interior de acabado gris de <strong>efecto textil</strong>.</p><p> </p><p dir=ltr>El <strong>cierre progresivo </strong>amortigua la puerta para evitar ruidos bruscos. Que todo sea cómodo y confortable.</p><p> </p><p dir=ltr>Casi estamos. Completa tu conjunto con el grifo, el sifón y los utilísimos muebles auxiliares a juego, que dotarán a tu baño de todavía más espacio para utensilios.</p><p> </p><p dir=ltr>Dale a tu aseo la calidad y el estilo que merece.</p>";"vitale,royo group,conjunto,muebles,baño,mueble,royo";"Conjunto mueble de baño de Royo suspendido 4 cajones Vitale 120 cm - Todomuebledebaño";"";"Comprar online Conjunto mueble de baño de Royo suspendido 4 cajones Vitale 120 cm ✅ ENVIO GRATUITO ✅ OFERTAS ✅ Especialistas en muebles de baño ✅ Fabricantes nacionales ✅ Todomueblesdebaño";"conjunto-mueble-de-bano-royo-vitale-lavabo-doble-poza-4-cajones-120-cm";"Disponible";"";1;"";"";1;"https://cdn.todomueblesdebano.com/image/upload/f_auto%2Cq_auto/v1/products/aa459321-70a7-4476-99b5-71131f60b50c/VITALE_120_4C_BlancoNature_Slim_Murano_Lucce_1_1668529075.4752648,https://cdn.todomueblesdebano.com/image/upload/f_auto%2Cq_auto/v1/products/aa459321-70a7-4476-99b5-71131f60b50c/Vitale_120_4C_BlancoNature_Murano_Lucce_suspjpg_1668529608.8061202,https://cdn.todomueblesdebano.com/image/upload/f_auto%2Cq_auto/v1/products/aa459321-70a7-4476-99b5-71131f60b50c/Vitale_120_4C_BlancoNature_Murano_Lucce_1675251813.5072248,https://cdn.todomueblesdebano.com/image/upload/f_auto%2Cq_auto/v1/products/aa459321-70a7-4476-99b5-71131f60b50c/Vitale_120_4C_ArenaMate_intSun_Murano_Lucce_copia_1675252142.8933437,https://cdn.todomueblesdebano.com/image/upload/f_auto%2Cq_auto/v1/products/aa459321-70a7-4476-99b5-71131f60b50c/cajones_XNBH6qi_1662474618.2189326,https://cdn.todomueblesdebano.com/image/upload/f_auto%2Cq_auto/v1/products/aa459321-70a7-4476-99b5-71131f60b50c/ENZO-ceramica_1717586822.313596,https://cdn.todomueblesdebano.com/image/upload/f_auto%2Cq_auto/v1/products/aa459321-70a7-4476-99b5-71131f60b50c/medidas-mueble-120cm-vitale-royo-group_1662474626.6634326,https://cdn.todomueblesdebano.com/image/upload/f_auto%2Cq_auto/v1/products/aa459321-70a7-4476-99b5-71131f60b50c/Vitale_120_4C_Beige_Nature_Slim_1668529113.9527645,https://cdn.todomueblesdebano.com/image/upload/f_auto%2Cq_auto/v1/products/aa459321-70a7-4476-99b5-71131f60b50c/Vitale_120_4C_Blanco_slim_1668529116.4294949,https://cdn.todomueblesdebano.com/image/upload/f_auto%2Cq_auto/v1/products/aa459321-70a7-4476-99b5-71131f60b50c/Vitale_120_4C__Slim_Blanco_Nature_1668529120.3328176,https://cdn.todomueblesdebano.com/image/upload/f_auto%2Cq_auto/v1/products/aa459321-70a7-4476-99b5-71131f60b50c/Vitale_120_4C__Slim_Gris_Nature_1668529122.9108644";"";1;"Tamaño de lavabo:Lavabo cerámico mide entre 1cm y 1,5 cm más que el mueble.:0;Serie:Vitale:0;Ancho seleccionable estándar:120 cm:1;Fondo seleccionable estándar:46 cm:2;Alto seleccionable estándar:56,5 cm:3;Colocación:Suspendido:4;Nº de cajones:4:5;Tipos de cajones:Extracción total con cierre amortiguado:6;Organizador de cajón:Incluido:7;Material del mueble:Tablero de partículas de madera:8;Medida del grosor del lateral del mueble:16 mm:9;Medida del grosor del frente del mueble:18 mm:10;Tiradores - Muebles de baño:Uñero:11;Tipo de montaje - Muebles de baño:Montado (ensamblado de fábrica):12;Medidas del lavabo:1,5 cm mayor que el mueble (si el mueble mide 80x45 cm, el lavabo medirá 81,5x46,5 cm):13;Medidas de la poza:12 cm de profundidad:14;Material del lavabo:Cerámica:15;Grosor del lavabo:2 cm:16;Posición del seno:Lavabo de doble seno sin faldón:17;Peso neto:41 kg:20;Fabricación:Estándar:21;Garantía:3 años:22";0;"new";0;0;0;0;1;"http://cdn.todomueblesdebano.com/raw/upload/v1668527329/products/aa459321-70a7-4476-99b5-71131f60b50c/VITALE_FichaTecnica_1668527329.2614033.pdf";"";"";"";1;0;0;0;"137,139,138,140,136,142,164,154,159,143,144,156,155,161,163,157,158,162,160,149,168,166,148,146,147,167,165,145,170,169,173,150,151,172,153,171,152"
100;1;"Conjunto mueble de baño Royo Vitale";"13";1059.0;1;"";1;222.32;17.35;"";"";"";"";"Royo Group";"Royo Group";"8414623358189";"";"";"";"120.0";"85.0";"46.0";0;"Entre 3 y 5 días";"";0;1;"";0;"both";"";"";"";"120 cm con 6 cajones, con patas y lavabo Enzo de cerámica";"<p>No te andas con medias tintas, ¿verdad? Lo quieres todo: gran tamaño, mucho espacio para guardar cosas, estilo innovador y todas las prestaciones. ¿Cierto? </p><p>Entonces lo que quieres es este conjunto de mueble de baño con patas Vitale, de Royo. </p><p dir=ltr>Este conjunto está pensado para quitarte preocupaciones.</p><p> </p><p dir=ltr>Tú decides qué color quieres que tenga tu mueble de baño. Elige entre el blanco brillante, el fumé mate o el recubrimiento 3D en blanco nature, beige nature o gris nature.</p><p> </p><p dir=ltr>¿Y lo querrás con o sin espejo? Tienes la oportunidad de incluir un espejo con aplique de luz Lucce de 30 cm con 5700 k 8W y 987 LM.</p><p> </p><p dir=ltr>El lavabo puede tener una o dos pozas, ¿como lo necesitas?</p><p> </p><p dir=ltr>Profundidad del seno 12.5 cm y espesor 2 cm.</p><p> </p><p dir=ltr>Míralo: 120 cm de ancho, 85 cm de alto(75 del mueble y 11 cm de las patas) y 46 de fondo. Y nada menos que seis cajones con tirador integrado.</p><p> </p><p dir=ltr>No se puede pedir más. Grande, amplio y con espacio para todos tus artículos de aseo.</p><p> </p><p dir=ltr>Estos se encontrarán bien ordenados en el interior gris de efecto textil con bandeja organizadora. Y se mostrarán ante ti gracias a la extracción total que facilita el sistema Indaux. El cierre progresivo reduce los ruidos en el baño.</p><p> </p><p dir=ltr>Para tenerlo todo, elige una válvula especial, un grifo y un mueble auxiliar para aumentar el espacio de almacenamiento.</p><p> </p><p dir=ltr>Con este conjunto de <a href=/muebles-bano-modernos/>mueble de baño moderno</a> Vitale no te va a faltar nada.</p><p> </p><p> </p>";"vitale,royo group,conjunto,muebles,baño,mueble,royo";"Conjunto mueble de baño de Royo con patas 6 cajones Vitale 120 cm - Todomueblesdebaño";"";"Comprar online Conjunto mueble de baño de Royo con patas 6 cajones Vitale 120 cm ✅ ENVIO GRATUITO ✅ OFERTAS ✅ Especialistas en muebles de baño ✅ Fabricantes nacionales ✅ Todomueblesdebaño";"conjunto-mueble-de-bano-royo-vitale-lavabo-doble-poza-6-cajones-120-cm";"Disponible";"";1;"";"";1;"https://cdn.todomueblesdebano.com/image/upload/f_auto%2Cq_auto/v1/products/f96cbc2f-a08e-4832-9d62-8cdeae03c4f2/vitale-6-cajones_MNbS7l9_1668600848.5043743,https://cdn.todomueblesdebano.com/image/upload/f_auto%2Cq_auto/v1/products/f96cbc2f-a08e-4832-9d62-8cdeae03c4f2/Vitale_120_6C_GrisNature_Slim_Murano_Limit_Perfil_1668600843.8489106,https://cdn.todomueblesdebano.com/image/upload/f_auto%2Cq_auto/v1/products/f96cbc2f-a08e-4832-9d62-8cdeae03c4f2/Vitale_120_6C_GrisNature_Slim_Murano_Lucce_1668600846.6640677,https://cdn.todomueblesdebano.com/image/upload/f_auto%2Cq_auto/v1/products/f96cbc2f-a08e-4832-9d62-8cdeae03c4f2/Vitale_3120_6C_GrisNature_Slim_Murano_Lucce_copia_1675259591.02919,https://cdn.todomueblesdebano.com/image/upload/f_auto%2Cq_auto/v1/products/f96cbc2f-a08e-4832-9d62-8cdeae03c4f2/Vitale_120_v_6C_GrisNature_Slim_Murano_Lucce_copia_1675259594.4622931,https://cdn.todomueblesdebano.com/image/upload/f_auto%2Cq_auto/v1/products/f96cbc2f-a08e-4832-9d62-8cdeae03c4f2/cajones_FIyhWZw_1662474636.115264,https://cdn.todomueblesdebano.com/image/upload/f_auto%2Cq_auto/v1/products/f96cbc2f-a08e-4832-9d62-8cdeae03c4f2/ENZO-ceramica_1718104014.7761464,https://cdn.todomueblesdebano.com/image/upload/f_auto%2Cq_auto/v1/products/f96cbc2f-a08e-4832-9d62-8cdeae03c4f2/vitale_6c_120_1668602210.341138,https://cdn.todomueblesdebano.com/image/upload/f_auto%2Cq_auto/v1/products/f96cbc2f-a08e-4832-9d62-8cdeae03c4f2/Vitale_120_3C_Slim_Beige_Nature_1668601001.6738286,https://cdn.todomueblesdebano.com/image/upload/f_auto%2Cq_auto/v1/products/f96cbc2f-a08e-4832-9d62-8cdeae03c4f2/Vitale_120_6C_Slim_Blanco_Brillo_1668601003.7846098,https://cdn.todomueblesdebano.com/image/upload/f_auto%2Cq_auto/v1/products/f96cbc2f-a08e-4832-9d62-8cdeae03c4f2/Vitale_120_6C_Slim_Blanco_Nature_1668601005.6504707,https://cdn.todomueblesdebano.com/image/upload/f_auto%2Cq_auto/v1/products/f96cbc2f-a08e-4832-9d62-8cdeae03c4f2/Vitale_120_6C_Slim_Gris_Nature_1668601008.9049003";"";1;"Serie:Vitale:0;Tamaño de lavabo:Lavabo cerámico mide entre 1cm y 1,5 cm más que el mueble.:0;Ancho seleccionable estándar:120 cm:1;Fondo seleccionable estándar:46 cm:2;Alto seleccionable estándar:85 cm:3;Colocación:Con patas:4;Nº de cajones:6:5;Tipos de cajones:Extracción total con cierre amortiguado:6;Organizador de cajón:Incluido:7;Material del mueble:Tablero de partículas de madera:8;Medida del grosor del lateral del mueble:16 mm:9;Medida del grosor del frente del mueble:18 mm:10;Tiradores - Muebles de baño:Uñero:11;Patas:Metálicas:12;Tipo de montaje - Muebles de baño:Montado (ensamblado de fábrica):13;Medidas del lavabo:1,5 cm mayor que el mueble (si el mueble mide 80x45 cm, el lavabo medirá 81,5x46,5 cm):14;Medidas de la poza:12,5 cm de profundidad:15;Material del lavabo:Cerámica:18;Posición del seno:Lavabo de doble seno sin faldón:19;Grosor del lavabo:2 cm:20;Peso neto:56 kg:21;Fabricación:Estándar:22;Garantía:3 años:23";0;"new";0;0;0;0;1;"http://cdn.todomueblesdebano.com/raw/upload/v1668600659/products/f96cbc2f-a08e-4832-9d62-8cdeae03c4f2/VITALE_FichaTecnica_1668600658.9877703.pdf";"";"";"";1;0;0;0;"138,139,140,137,136,144,154,156,159,157,160,162,142,161,158,164,155,143,163,145,147,149,146,148,173,170,169,150,151,171,172,153,152"
101;1;"Conjunto mueble de baño Royo Urban";"13";523.0;1;"";1;109.8;17.35;"";"";"";"";"Royo Group";"Royo Group";"8414623377029";"";"";"";"";"85.0";"46.0";0;"Entre 3 y 5 días";"";0;1;"";0;"both";"";"";"";"3 cajones con patas y lavabo Enzo de cerámica";"<p>Si estás buscando un <strong>mueble de baño amplio y con cajones de gran tamaño,</strong> esta opción es ideal para ti. El conjunto Urban de estilo moderno se puede adquirir en un tamaño de 60, 80 o 100 cm de anchura. En todos los casos, la altura sería de 74 + 11 cm de patas x cm y el fondo de 46 cm. Hablamos de un mueble perfecto para tu baño.</p><p><br></p><p>Es un <strong>mueble de baño con patas</strong> de gran calidad, que aseguran la estabilidad del mueble. No tendrás así que preocuparte por nada más, ya que es de muy fácil instalación.</p><p>Puedes adquirir este mueble con <a href=/lavabos-encastrados/ rel=noopener noreferrer target=_blank style=color: rgb(0, 123, 255),>lavabo encastrado</a> Enzo, o además comprar la opción con Espejo Murano y aplique LED Uri. Fíjate bien en las opciones para elegir el que realmente necesitas.</p><p><br></p><p>El mueble tiene 3 cajones con <strong>guías Indaux</strong>. Son cajones robustos y con sistema de cierre suave amortiguado Soft Close. Además se pueden extraer totalmente para una limpieza más en profundidad. Destacamos que tiene organizador de cajón y cuenta con tiradores de madera patentados de Royo Group, trabajados directamente sobre el frente de cajón, lo que le da un toque decorativo muy elegante y sosfisticado.</p><p><br></p><p>Si buscas un mueble en tonos naturales, te damos varias opciones de <strong>acabado</strong> para elegir. Compra este mueble en Blanco Nature, Beige Nature o Gris Nature. Tienes también la opción del mueble Blanco mate. Colores que se adaptan muy bien a tu cuarto de baño.</p><p>El lavabo Enzo está hecho de <strong>cerámica/porcelana</strong>. Resiste bien los impactos, soporta la humedad, previene las abolladuras y es poco poroso. En definitiva, el lavabo perfecto que necesitas. En la opción del Urban de 3 cajones, este lavabo es de 1 poza.</p><p><br></p><p>Si quieres comprar el <strong>conjunto de baño con espejo y aplique de luz</strong>, te daremos un espejo Murano de 70 cm de alto y un aplique de luz LED Uri de 30 cm. Así podrás completar tu cuarto de baño.</p><p><br></p><p>Tienes también otras opciones en complementos, especialmente pensadas para los muebles de esta marca y serie, que te podrán servir para que tengas el conjunto de baño ideal que estabas buscando.</p><p><br></p><p> </p><p><br></p>";"urban,royo group,conjunto,muebles,baño,mueble,royo";"Conjunto mueble de baño Royo Group Urban con patas 3 cajones - Todomueblesdebaño";"";"Comprar online Conjunto mueble de baño Royo Group Urban con patas 3 cajones ✅ OFERTAS ✅ Especialistas en muebles de baño ✅ Fabricantes nacionales ✅ Todomueblesdebaño";"conjunto-mueble-de-bano-royo-urban-3-cajones";"Disponible";"";1;"";"";1;"https://cdn.todomueblesdebano.com/image/upload/f_auto%2Cq_auto/v1/products/cba641da-38c9-43be-81ef-9925fb0dafbe/URBAN_80_3C_BlancoNature_Slim_1669307875.4974039,https://cdn.todomueblesdebano.com/image/upload/f_auto%2Cq_auto/v1/products/cba641da-38c9-43be-81ef-9925fb0dafbe/URBAN_80_3C_BlancoNature_Notte_Lua_1669307872.776277,https://cdn.todomueblesdebano.com/image/upload/f_auto%2Cq_auto/v1/products/cba641da-38c9-43be-81ef-9925fb0dafbe/URBAN_120_6C_BeigeNature_Slim_1669307878.1223478,https://cdn.todomueblesdebano.com/image/upload/f_auto%2Cq_auto/v1/products/cba641da-38c9-43be-81ef-9925fb0dafbe/Urban_100_3C_BlancoMate_Slim_Murano_Uri_1669307880.1577055,https://cdn.todomueblesdebano.com/image/upload/f_auto%2Cq_auto/v1/products/cba641da-38c9-43be-81ef-9925fb0dafbe/Urban_100_3C_BlancoNature_Slim_Blaze_1669307881.7357903,https://cdn.todomueblesdebano.com/image/upload/f_auto%2Cq_auto/v1/products/cba641da-38c9-43be-81ef-9925fb0dafbe/detalle-organizador-cajon-urban-royo-group_1662475535.3703249,https://cdn.todomueblesdebano.com/image/upload/f_auto%2Cq_auto/v1/products/cba641da-38c9-43be-81ef-9925fb0dafbe/detalle-tirador_SIV2z2h_1662475540.1094823,https://cdn.todomueblesdebano.com/image/upload/f_auto%2Cq_auto/v1/products/cba641da-38c9-43be-81ef-9925fb0dafbe/ENZO-ceramica_1718103762.169914,https://cdn.todomueblesdebano.com/image/upload/f_auto%2Cq_auto/v1/products/cba641da-38c9-43be-81ef-9925fb0dafbe/Urban_80_3C_BlancoNature_1669309620.4471009,https://cdn.todomueblesdebano.com/image/upload/f_auto%2Cq_auto/v1/products/cba641da-38c9-43be-81ef-9925fb0dafbe/Urban_80_3C_BlancoMate_1669309623.4192998,https://cdn.todomueblesdebano.com/image/upload/f_auto%2Cq_auto/v1/products/cba641da-38c9-43be-81ef-9925fb0dafbe/Urban_80_3C_BeigeNature_1669309625.2759044,https://cdn.todomueblesdebano.com/image/upload/f_auto%2Cq_auto/v1/products/cba641da-38c9-43be-81ef-9925fb0dafbe/Urban_80_3C_GrisNature_1669309627.5839841";"";1;"Tamaño de lavabo:Lavabo cerámico mide entre 1cm y 1,5 cm más que el mueble.:0;Serie:Urban:0;Fondo seleccionable estándar:46 cm:2;Alto seleccionable estándar:85 cm:3;Colocación:Con patas:4;Nº de cajones:3:5;Tipos de cajones:Extracción total con cierre amortiguado:6;Organizador de cajón:Incluido:7;Material del mueble:MDF:8;Medida del grosor del lateral del mueble:16 mm:9;Medida del grosor del frente del mueble:18 mm:10;Tiradores - Muebles de baño:Tirador integrado patentado:11;Patas:Metálicas:12;Tipo de montaje - Muebles de baño:Montado (ensamblado de fábrica):13;Medidas del lavabo:1,5 cm mayor que el mueble (si el mueble mide 80x45 cm, el lavabo medirá 81,5x46,5 cm):14;Medidas de la poza:12,5 cm de profundidad:15;Material del lavabo:Cerámica:16;Posición del seno:Lavabo de un seno centrado sin faldón:19;Grosor del lavabo:2 cm:20;Fabricación:Estándar:21;Garantía:3 años:22";0;"new";0;0;0;0;1;"http://cdn.todomueblesdebano.com/raw/upload/v1669823072/products/cba641da-38c9-43be-81ef-9925fb0dafbe/URBAN_FichaTecnica_1669823072.0390387.pdf";"";"";"";1;0;0;0;"140,139,137,138,136,156,143,157,163,142,144,158,164,161,160,162,155,154,159,147,148,149,145,146,170,174,169,150,152,153,172,151,171"
102;1;"Conjunto mueble de baño Royo Urban";"13";450.0;1;"";1;94.47;17.35;"";"";"";"";"Royo Group";"Royo Group";"8414623377449";"";"";"";"";"56.5";"46.0";0;"Entre 3 y 5 días";"";0;1;"";0;"both";"";"";"";"2 cajones suspendido con lavabo Enzo de cerámica";"<p>Este conjunto está <strong>disponible en medidas de 60, 80, 100 o 120 cm de ancho</strong>, 46 cm de fondo y 56.5 cm de alto. Es un <a href=/muebles-de-bano/ rel=noopener noreferrer target=_blank style=color: rgb(0, 123, 255),>mueble de baño</a> amplio y con espacio suficiente de almacenamiento para que puedas guardar lo que necesites.</p><p><br></p><p>La colocación es <strong>suspendida a pared</strong>, lo que permitirá que el mueble tenga una buena adherencia y una gran firmeza. Además, esto genera un ambiente de baño más abierto y menos sobrecargado, lo que va muy bien para la decoración.</p><p><br></p><p>Se puede elegir la opción de mueble de baño Urban + Lavabo Enzo o Mueble de Baño Urban + Lavabo Enzo + Espejo Murano + Aplique de luz LED Uri.</p><p><br></p><p>El conjunto Urban se compone de un mueble de baño de <strong>2 cajones de extracción total</strong>, cierre suave amortiguado y guías Hettich. Te garantiza una cómoda y fácil apertura del cajón. Son cajones resistentes. Cuenta con un organizador de cajón para que puedas ordenar mejor la información. Destacamos sus TIRADORES tallados en el frente del mueble, de gran calidad y diseño muy original.</p><p>Los <strong>acabados </strong>de este modelo son muy elegantes, en laminado color madera Gris Nature, Blanco Nature o Beige Nature, o bien acabado mate Blanco. Tonos cálidos y fáciles de combinar en cualquier cuarto de baño.</p><p><br></p><p>Incluye un <strong>lavabo Enzo de cerámica </strong>encastrado. La cerámica es un material que destaca por su baja porosidad y gran resistencia. Lo ideal para que tu lavabo esté limpio y se conserve en buenas condiciones.</p><p>Tienes la opción de agregar también un <strong>espejo Murano</strong> en forma rectangular con aplique de luz LED Uri. El espejo tiene una medida de 70 cm de alto y un ancho adecuado al tamaño del mueble.</p><p><br></p><p>El conjunto es de fácil montaje, por lo que apenas te va a suponer trabajo la instalación.</p><p><br></p><p>Además hay<strong> otros muchos complementos</strong> que puedes agregar, como grifo de lavabo, auxiliar de baño o válvula.</p><h2><br></h2><h2><br></h2><p> </p><p><br></p>";"urban,royo group,conjunto,muebles,baño,mueble,royo";"Conjunto mueble de baño Royo Group Urban suspendido 2 cajones - Todomueblesdebaño";"";"Comprar online Conjunto mueble de baño Royo Group Urban suspendido 2 cajones ✅ OFERTAS ✅ Especialistas en muebles de baño ✅ Fabricantes nacionales ✅ Todomueblesdebaño";"conjunto-mueble-de-bano-royo-urban-2-cajones";"Disponible";"";1;"";"";1;"https://cdn.todomueblesdebano.com/image/upload/f_auto%2Cq_auto/v1/products/871a0f82-2c47-4716-9ffc-34edde1765b0/URBAN_80_2C_BlancoNature_Enzo_1669306825.6728692,https://cdn.todomueblesdebano.com/image/upload/f_auto%2Cq_auto/v1/products/871a0f82-2c47-4716-9ffc-34edde1765b0/URBAN_80_2C_BlancoMate_Enzo_1669306823.2885463,https://cdn.todomueblesdebano.com/image/upload/f_auto%2Cq_auto/v1/products/871a0f82-2c47-4716-9ffc-34edde1765b0/URBAN_100_2C_BlancoNature_Enzo_1669306827.194689,https://cdn.todomueblesdebano.com/image/upload/f_auto%2Cq_auto/v1/products/871a0f82-2c47-4716-9ffc-34edde1765b0/URBAN_100_2C_GrisNature_Enzo_1669306829.4439344,https://cdn.todomueblesdebano.com/image/upload/f_auto%2Cq_auto/v1/products/871a0f82-2c47-4716-9ffc-34edde1765b0/URBAN_100_2C_GrisNature_Enzo_Due_1669306831.8996878,https://cdn.todomueblesdebano.com/image/upload/f_auto%2Cq_auto/v1/products/871a0f82-2c47-4716-9ffc-34edde1765b0/URBAN_120_1673612331.7576602,https://cdn.todomueblesdebano.com/image/upload/f_auto%2Cq_auto/v1/products/871a0f82-2c47-4716-9ffc-34edde1765b0/cajon-urban-royo_A8eocH4_1662475478.5194142,https://cdn.todomueblesdebano.com/image/upload/f_auto%2Cq_auto/v1/products/871a0f82-2c47-4716-9ffc-34edde1765b0/detalle-tirador_e27E5Le_1662475491.9733384,https://cdn.todomueblesdebano.com/image/upload/f_auto%2Cq_auto/v1/products/871a0f82-2c47-4716-9ffc-34edde1765b0/Urban_100_2C_BlancoMate_1669304769.229223,https://cdn.todomueblesdebano.com/image/upload/f_auto%2Cq_auto/v1/products/871a0f82-2c47-4716-9ffc-34edde1765b0/Urban_100_2C_BlancoNature_1669304771.2454712,https://cdn.todomueblesdebano.com/image/upload/f_auto%2Cq_auto/v1/products/871a0f82-2c47-4716-9ffc-34edde1765b0/Urban_100_2C_GrisNature_1669304772.8080578,https://cdn.todomueblesdebano.com/image/upload/f_auto%2Cq_auto/v1/products/871a0f82-2c47-4716-9ffc-34edde1765b0/Urban_100_2C_BeigeNature_1669304774.667164";"";1;"Serie:Urban:0;Tamaño de lavabo:Lavabo cerámico mide entre 1cm y 1,5 cm más que el mueble.:0;Fondo seleccionable estándar:46 cm:2;Alto seleccionable estándar:56,5 cm:3;Colocación:Suspendido:4;Nº de cajones:2:5;Tipos de cajones:Extracción total con cierre amortiguado:6;Organizador de cajón:Incluido:7;Material del mueble:MDF:8;Medida del grosor del lateral del mueble:16 mm:9;Medida del grosor del frente del mueble:18 mm:10;Tiradores - Muebles de baño:Tirador integrado patentado:11;Tipo de montaje - Muebles de baño:Montado (ensamblado de fábrica):12;Medidas del lavabo:1,5 cm mayor que el mueble (si el mueble mide 80x45 cm, el lavabo medirá 81,5x46,5 cm):13;Medidas de la poza:12 cm de profundidad:14;Material del lavabo:Cerámica:15;Posición del seno:Lavabo de un seno centrado sin faldón:18;Grosor del lavabo:2,1 cm:19;Fabricación:Estándar:20;Garantía:3 años:21";0;"new";0;0;0;0;1;"http://cdn.todomueblesdebano.com/raw/upload/v1669637452/products/871a0f82-2c47-4716-9ffc-34edde1765b0/URBAN_FichaTecnica_1_1669637452.030449.pdf";"";"";"";1;0;0;0;"140,138,136,137,139,160,158,142,161,162,154,159,143,155,163,164,157,156,144,149,166,167,145,147,165,168,146,148,170,174,169,150,152,153,171,151,172"
