120;1;"Mueble de baño Royo Vida";"13";221.504132;1;"";1;46.5;17.35;"";"";"127659";"";"Royo Group";"Royo Group";"8414623536457";"";"";"";"";"28.4";"45.0";0;"Entre 20 y 25 días";"";0;1;"";0;"both";"";"";"";"1 cajón, suspendido con tirador disponible en varios colores, ideal para cambiar el estilo de tu baño";"<p>¡Bienvenido al mundo de posibilidades del <a href=/muebles-de-bano/ rel=noopener noreferrer target=_blank>Mueble de Baño</a> Vida Royo! </p><p><br></p><p>Este encantador mueble de baño ofrece una gama impresionante de <strong>10 colores para elegir</strong>, desde el clásico Blanco Brillo hasta el sofisticado Negro Mate, ¡y todos los tonos hermosos intermedios!</p><p><br></p><p>Sus <strong>medidas perfectas de 60/100 cm de ancho, 45 cm de fondo y 28.4 cm de alto</strong> hacen que se ajuste a cualquier espacio. Además, su instalación suspendida a la pared no solo aporta estilo moderno, sino también una sensación de amplitud visual, transformando tu baño en un santuario de tranquilidad.</p><p><br></p><p>El <a href=/muebles-de-bano/q/?colocacion-mueble=Suspendido+a+pared rel=noopener noreferrer target=_blank>Mueble de Baño suspendido</a> Vida Royo presenta <strong>un cajón</strong> con apertura total y cierre amortiguado, proporcionando una experiencia suave y silenciosa cada vez. El interior fumé cuero añade un toque de elegancia y practicidad, mientras que el organizador de cajón te ayuda a mantener todo ordenado y accesible.</p><p><br></p><p>Elige el <strong>tirador </strong>que mejor se adapte a tu estilo entre opciones de <strong>Blanco, Cromo, Negro, Acero Cepillado u Oro Cepillado</strong>. Y lo mejor de todo, este mueble se fabrica localmente, apoyando la economía de nuestra comunidad y cuenta con el prestigioso sello FSC de madera proveniente de bosques sostenibles.</p><p><br></p><p>Y eso no es todo, ¡puedes personalizar tu espacio aún más añadiendo lavabos, espejos, grifería y otros complementos que combinen a la perfección! <a href=/muebles-bano-modernos/ rel=noopener noreferrer target=_blank>Mueble de baño moderno</a> con 3 años de garantía.</p><p><br></p><p>Haz de tu baño un lugar especial con el Mueble de Baño Vida Royo 1 Cajón. ¡Tu oasis personal te espera!</p>";"royo group,vida,muebles,baño,mueble,royo";"▷ Mueble de baño Royo Vida - Todomueblesdebaño";"";"Comprar online Mueble de baño Royo Vida / ¡Envío gratuito! / Entrega rápida / Garantía 3 años / Fabricación nacional / Todo Muebles de Baño / ¡Compra ahora!";"mueble-bano-royo-vida";"Disponible";"";1;"";"";1;"https://cdn.todomueblesdebano.com/image/upload/f_auto%2Cq_auto/v1/products/d5e2184b-a946-4d42-aeac-02b0e5010511/azul_1698079948.614438,https://cdn.todomueblesdebano.com/image/upload/f_auto%2Cq_auto/v1/products/d5e2184b-a946-4d42-aeac-02b0e5010511/vida-1-cajon-blanco_1662475276_1698079732.00062,https://cdn.todomueblesdebano.com/image/upload/f_auto%2Cq_auto/v1/products/d5e2184b-a946-4d42-aeac-02b0e5010511/tirador_kn7ji2S_1662475278_1698079720.3949234,https://cdn.todomueblesdebano.com/image/upload/f_auto%2Cq_auto/v1/products/d5e2184b-a946-4d42-aeac-02b0e5010511/Vida_100_1C_AzulNavyMate_InteriorCajón_1698079725.318745,https://cdn.todomueblesdebano.com/image/upload/f_auto%2Cq_auto/v1/products/d5e2184b-a946-4d42-aeac-02b0e5010511/Vida_AzulNavy_DetalleTirador_1698079861.467082,https://cdn.todomueblesdebano.com/image/upload/f_auto%2Cq_auto/v1/products/d5e2184b-a946-4d42-aeac-02b0e5010511/Vida_100_1C_AzulNavyMate_Sky_Eclipse_1698079727.5452542,https://cdn.todomueblesdebano.com/image/upload/f_auto%2Cq_auto/v1/products/d5e2184b-a946-4d42-aeac-02b0e5010511/Vida_100_1C_120_2C_AzulNavyMate_Sky_Eclipse_Halo_1698079722.095641,https://cdn.todomueblesdebano.com/image/upload/f_auto%2Cq_auto/v1/products/d5e2184b-a946-4d42-aeac-02b0e5010511/vida-1-cajon_1662475272_1698079730.1549122,https://cdn.todomueblesdebano.com/image/upload/f_auto%2Cq_auto/v1/products/d5e2184b-a946-4d42-aeac-02b0e5010511/medida-trasera-1-cajon_WsOoWY5_1662475284_1698079718.3215833";"";1;"Serie:Vida:0;Fondo seleccionable estándar:45 cm:2;Alto seleccionable estándar:28.4 cm:3;Colocación:Suspendido:4;Nº de cajones:1:5;Tipos de cajones:Guías Hettich extracción total con cierre amortiguado:6;Organizador de cajón:Incluido:7;Material del mueble:Tablero de partículas de madera:8;Medida del grosor del frente del mueble:18 mm:9;Medida del grosor del lateral del mueble:16 mm:10;Tiradores - Muebles de baño:Tirador metálico:11;Patas:Sin patas:12;Tipo de montaje - Muebles de baño:Montado (ensamblado de fábrica):13;Fabricación:A medida:16;Garantía:3 años:18";0;"new";0;0;0;0;1;"http://cdn.todomueblesdebano.com/raw/upload/v1698079702/products/d5e2184b-a946-4d42-aeac-02b0e5010511/VIDA_MODULAR_FichaTecnica_1698079700.95376.pdf";"";"";"";1;0;0;0;"200,201,199,140,195,186,138,139,154,144,159,158,157,161,162,143,160,164,156,155,163,142,145,167,165,147,146,149,148,168,166,170,203,169,202,150,172,152,151,153,171"
121;1;"Mueble de baño con encimera de madera Royo Vida";"13";432.0;1;"";1;90.69;17.35;"";"";"126641";"";"Royo Group";"Royo Group";"8414623382962";"";"";"";"";"56.5";"45.0";0;"Entre 20 y 25 días";"";0;1;"";0;"both";"";"";"";"2 cajones, suspendido con tirador disponible en varios colores, estilo y calidad para tu baño";"<p> ¿Quieres darle a tu baño un toque único y moderno? </p><p><br></p><p>¡El <a href=/muebles-de-bano/ rel=noopener noreferrer target=_blank><strong>Mueble de baño</strong></a><strong> Vida Royo 2 cajones con encimera de madera</strong> es la solución perfecta! Con una amplia variedad de <strong>colores para elegir</strong>, como <strong>blanco brillo, antracita brillo, gris arenado, nogal arenado, roble eternity, verde pure, galet mate, negro mate, azul navy mate y blanco mate</strong>, este mueble se adaptará perfectamente a tu estilo personal.</p><p><br></p><p>Con <strong>medidas</strong> de <strong>60/80/100 cm de ancho, 45 cm de fondo y 56.5 cm de alto</strong>, este mueble se ajusta a cualquier tamaño de baño. Además, su <strong>instalación suspendida a la pared</strong> le brinda una apariencia moderna y crea una <strong>sensación de amplitud</strong> en tu baño, ¡te encantará!</p><p><br></p><p>El <strong>estilo</strong> de este mueble es simplemente excepcional. Con una <strong>composición de 2 cajones</strong> con <strong>apertura total y cierre amortiguado</strong>, tendrás suficiente espacio para guardar todos tus artículos de baño de forma organizada y accesible. No te preocupes por el desorden, ¡el <strong>organizador de cajón incluido</strong> hará maravillas! <a href=/muebles-de-bano/q/?colocacion-mueble=Suspendido+a+pared rel=noopener noreferrer target=_blank>Mueble de baño suspendido</a>.</p><p><br></p><p>Además, el Mueble de baño Vida Royo es <strong>fabricado en el país</strong>, lo que contribuye a apoyar la economía local. Y lo mejor de todo, cuenta con el <strong>sello FSC</strong>, lo que significa que la madera utilizada proviene de <strong>bosques sostenibles</strong>, ¡una elección ecológica que te hará sentir bien!</p><p><br></p><p>Si buscas personalización, elige el <strong>tirador en tu color favorito</strong>: blanco, cromo, negro, acero cepillado u oro cepillado. Y para resaltar su belleza, este mueble viene con una <strong>encimera de madera</strong> que puedes elegir en varios colores. ¡Tu baño lucirá increíblemente elegante! Un <a href=/muebles-bano-modernos/ rel=noopener noreferrer target=_blank>mueble de baño moderno</a> perfecto para tu nuevo baño.</p><p><br></p><p>Pero espera, hay más. Este mueble te ofrece la posibilidad de agregar <strong>lavabos, espejos, grifería</strong> y otros complementos para completar tu espacio de baño de ensueño. ¡La elección es tuya!</p><p><br></p><p>Con una <strong>garantía de 3 años</strong>, tendrás la tranquilidad de saber que estás adquiriendo un producto de calidad y duradero. Así que no te lo pienses dos veces, ¡déjate llevar por la belleza y la funcionalidad del <strong>Mueble de baño Vida Royo 2 cajones con encimera de madera</strong> y haz de tu baño un lugar especial!</p>";"royo group,vida,madera,muebles,baño,encimera,mueble,royo";"▷ Mueble de baño de 2 cajones con encimera de madera Royo Vida - Todomueblesdebaño";"";"Comprar online Mueble de baño de 2 cajones con encimera de madera Royo Vida / ¡Envío gratuito! / Entrega rápida / Garantía 3 años / Fabricación nacional / Todo Muebles de Baño / ¡Compra ahora!";"mueble-bano-encimera-2-cajones-royo-vida";"Disponible";"";1;"";"";1;"https://cdn.todomueblesdebano.com/image/upload/f_auto%2Cq_auto/v1/products/51a822af-a446-490c-92dd-2a0b893d082b/Composicion-vida-royo_hucwU0u_1662475351_1698144566.6842387,https://cdn.todomueblesdebano.com/image/upload/f_auto%2Cq_auto/v1/products/51a822af-a446-490c-92dd-2a0b893d082b/cajon_htRUzeN_1662475357_1698144564.885535,https://cdn.todomueblesdebano.com/image/upload/f_auto%2Cq_auto/v1/products/51a822af-a446-490c-92dd-2a0b893d082b/tirador_RpMxhu9_1662475359_1698144568.7395346,https://cdn.todomueblesdebano.com/image/upload/f_auto%2Cq_auto/v1/products/51a822af-a446-490c-92dd-2a0b893d082b/2-cajones-trasera_1662475364_1698144563.26681";"";1;"Serie:Vida:0;Fondo seleccionable estándar:45 cm:2;Alto seleccionable estándar:56.5 cm:3;Colocación:Suspendido:4;Nº de cajones:2:5;Tipos de cajones:Guías Hettich extracción total con cierre amortiguado:6;Organizador de cajón:Incluido:7;Material del mueble:Tablero de partículas de madera:8;Medida del grosor del frente del mueble:18 mm:9;Medida del grosor del lateral del mueble:16 mm:10;Tiradores - Muebles de baño:Tirador metálico:11;Patas:Sin patas:12;Tipo de montaje - Muebles de baño:Montado (ensamblado de fábrica):13;Fabricación:Estándar:17;Garantía:3 años:19";0;"new";0;0;0;0;1;"http://cdn.todomueblesdebano.com/raw/upload/v1698144539/products/51a822af-a446-490c-92dd-2a0b893d082b/VIDA_MODULAR_FichaTecnica_1698144538.2579138.pdf";"";"";"";1;0;0;0;"178,177,180,179,181,183,184,182,204,196,206,194,205,195,193,156,155,143,157,160,144,154,159,161,158,142,162,163,164,146,168,145,166,167,147,148,165,149,202,170,203,169,150,153,151,172,171,152"
122;1;"Conjunto mueble de baño Royo Sansa";"13";302.0;1;"";1;63.4;17.35;"";"";"";"";"Royo Group";"Royo Group";"8414623359063";"";"";"";"";"56.5";"46.0";0;"Entre 3 y 5 días";"";0;1;"";0;"both";"";"";"";"2 cajones, suspendido con lavabo Enzo de cerámica";"<p><strong><u>Mueble de baño Royo Sansa</u></strong></p><p><br></p><p>Especialmente encantador es el toque rústico escandinavo del mueble de baño de Royo Sansa. Con sus dos grandes cajones, colocación suspendida y lavabo encastrado, es <strong>práctico, versátil y fácil de combinar. </strong></p><p>La funcionalidad de este <a href=/muebles-de-bano/ rel=noopener noreferrer target=_blank style=color: rgb(255, 125, 0),>mueble de baño</a> reside en su <strong>gran capacidad para guardar enseres, accesorios o cosméticos. </strong></p><p>Una de las mejores características del mueble de baño Royo Sansa es que utiliza las <strong>guías Hettich alemanas para abrir sus cajones. </strong>Además, lleva un cierre amortiguado para que no sufran desgaste. Su acabado lacado lo puedes elegir de tipo rústico, más propio de la decoración nórdica, pero también en blanco o gris antracita. </p><p>Recuerda que un frontal que imite madera siempre aportará calidez y creará un espacio de baño más acogedor. No obstante, si te gustan los baños más minimalistas o industriales, puedes escoger un tono gris fumé o antracita (casi negro). </p><p><br></p><p><strong><u>Las dimensiones del mueble de baño de Royo Sansa</u></strong></p><p><br></p><p>El fondo de este mueble de la marca Royo es estándar (46 cm), aunque la firma tiene otros de fondo reducido. <strong>Su altura también es fija (56,5 cm)</strong>. El ancho lo puedes elegir a la medida de tu aseo. Aunque se fabrica de forma estandarizada, lo que agiliza la entrega, lo tienes con: </p><ul><li>60 cm. </li><li>70 cm. </li><li>80 cm. </li><li>100 cm.</li></ul><p><br></p><p>Como ves, todas estas medidas de ancho están<strong> concebidas para encajar en baños pequeños o medianos</strong>. Este práctico mueble lo puedes conseguir en forma de conjunto, con el lavabo de cerámica encastrado Enzo, diferentes espejos y apliques de luz. </p><p>Por otro lado, podrás elegir, si lo deseas, una bonita <a href=/griferia-bano/ rel=noopener noreferrer target=_blank style=color: rgb(255, 125, 0),>grifería de lavabo</a> y un mueble columna de baño auxiliar del mismo acabado. </p><p>Otros extras muy interesantes del mueble de baño Royo Sansa son: el interior textil en color gris de los cajones, el tirador incorporado que no sobresale ni entorpece el movimiento y su fácil ensamblado. También puedes culminar tu compra con un toallero anexo o un soporte para el secador. ¿Qué dices? ¿Te lo llevas puesto?</p><p><br></p><p><strong><u>Mueble de baño moderno Sansa</u></strong></p><p><br></p><p>Los <a href=/muebles-bano-modernos/ rel=noopener noreferrer target=_blank style=color: rgb(255, 125, 0),>muebles de baño modernos</a> le dan a tu baño mucha personalidad y calidez. Con acabados muy bonitos, el mueble Sansa de Royo Group es la opción perfecta para realzar la estética y la belleza de tu baño.</p><p><br></p><p>Entre sus principales ventajas, queremos destacar:</p><p><br></p><ul><li><strong>Acabado en antracita</strong>, blanco, nogal arenado o gris arenado. Estos colores te garantizan que puedes combinar tu mueble con las más variadas decoraciones.</li><li><strong>Medidas de entre 80 y 100 cm</strong>, un fondo de 46 cm y una altura de 56.5 cm para que puedas integrarlo en tu baño sin mayor dificultad. Profundidad del seno 12 cm y espesor 2.1 cm.</li><li><strong>2 cajones</strong>: los cajones cuentan con sistema Soft Close para un cierre suave y amortiguado. Además, en su interior los cajones son de color gris. Cuenta también con tirador ergonómico integrado.</li><li><strong>Fácil de instalar</strong>: ya viene todo ensamblado. Al ser un mueble suspendido, podrás tenerlo bien adosado a la pared, disfrutando de espacio suficiente para limpiar debajo y una perfecta consistencia.</li><li><strong>Añade tu mueble auxiliar</strong>, columna de baño, apliques de luz o espejo para crear un ambiente armónico y uniforme.</li></ul><p><br></p><p dir=ltr>Con tu mueble baño de la serie Sansa crearás un ambiente único y envolvente, que reflejará la funcionalidad y delicadeza de su diseño.</p><p dir=ltr><br></p><p dir=ltr><br></p>";"sansa,royo group,conjunto,muebles,baño,mueble,royo";"▷ Conjunto mueble de baño de Royo Sansa suspendido 2 cajones - Todomueblesdebaño";"";"Comprar online Conjunto mueble de baño de Royo Sansa suspendido 2 cajones ✅ ENVIO GRATUITO ✅ OFERTAS ✅ Especialistas en muebles de baño ✅ Fabricantes nacionales ✅ Todomueblesdebaño";"conjunto-mueble-de-bano-royo-sansa-suspendido-2-cajones";"Disponible";"";1;"";"";1;"https://cdn.todomueblesdebano.com/image/upload/f_auto%2Cq_auto/v1/products/b5ba301f-4be1-48d6-962a-70cde2f606a5/SANSA_80_2C_GrisArenado_Slim_Uri_1668605259.5330374,https://cdn.todomueblesdebano.com/image/upload/f_auto%2Cq_auto/v1/products/b5ba301f-4be1-48d6-962a-70cde2f606a5/SANSA_80_2C_Antracita_Slim_Uri_1668605262.1239107,https://cdn.todomueblesdebano.com/image/upload/f_auto%2Cq_auto/v1/products/b5ba301f-4be1-48d6-962a-70cde2f606a5/Sansa_80_2C_AntracitaBrillo_Piazza_Murano_1675266646.474264,https://cdn.todomueblesdebano.com/image/upload/f_auto%2Cq_auto/v1/products/b5ba301f-4be1-48d6-962a-70cde2f606a5/navy_1705658782.218491,https://cdn.todomueblesdebano.com/image/upload/f_auto%2Cq_auto/v1/products/b5ba301f-4be1-48d6-962a-70cde2f606a5/cajones_ecSCJ8V_1662474810.583156,https://cdn.todomueblesdebano.com/image/upload/f_auto%2Cq_auto/v1/products/b5ba301f-4be1-48d6-962a-70cde2f606a5/SANSA_Tirador_LavaboSlim_1662474814.4558892,https://cdn.todomueblesdebano.com/image/upload/f_auto%2Cq_auto/v1/products/b5ba301f-4be1-48d6-962a-70cde2f606a5/Sansa_100_FuméArenado_InteriorCajón_1668605298.1373172,https://cdn.todomueblesdebano.com/image/upload/f_auto%2Cq_auto/v1/products/b5ba301f-4be1-48d6-962a-70cde2f606a5/Enzo_copia_1669123245.6004148,https://cdn.todomueblesdebano.com/image/upload/f_auto%2Cq_auto/v1/products/b5ba301f-4be1-48d6-962a-70cde2f606a5/Sansa_80_Antracita_Slim_1668605321.3421648,https://cdn.todomueblesdebano.com/image/upload/f_auto%2Cq_auto/v1/products/b5ba301f-4be1-48d6-962a-70cde2f606a5/Sansa_80_Blanco_Slim_1668605322.921955,https://cdn.todomueblesdebano.com/image/upload/f_auto%2Cq_auto/v1/products/b5ba301f-4be1-48d6-962a-70cde2f606a5/Sansa_100_NogalArenado_Slim_1668605324.214695,https://cdn.todomueblesdebano.com/image/upload/f_auto%2Cq_auto/v1/products/b5ba301f-4be1-48d6-962a-70cde2f606a5/Sansa_80_GrisArenado_Slim_1668605327.763791,https://cdn.todomueblesdebano.com/image/upload/f_auto%2Cq_auto/v1/products/b5ba301f-4be1-48d6-962a-70cde2f606a5/Guias-Hettich_s7LBdVa_BxJnGUq_1662474819.9629123";"";1;"Tamaño de lavabo:Lavabo cerámico mide entre 1cm y 1,5 cm más que el mueble.:0;Serie:Sansa:0;Fondo seleccionable estándar:46 cm:2;Alto seleccionable estándar:56.5 cm:3;Colocación:Suspendido:4;Nº de cajones:2:5;Tipos de cajones:Guías Hettich extracción total con cierre amortiguado:6;Material del mueble:Tablero de partículas de madera:7;Medida del grosor del frente del mueble:16 mm:8;Medida del grosor del lateral del mueble:16 mm:9;Tipo de montaje - Muebles de baño:Montado (ensamblado de fábrica):12;Tiradores - Muebles de baño:Uñero:13;Medidas del lavabo:1,5 cm mayor que el mueble (si el mueble mide 80x45 cm, el lavabo medirá 81,5x46,5 cm):14;Medidas de la poza:12 cm de profundidad:15;Material del lavabo:Cerámica:16;Posición del seno:Lavabo de un seno centrado sin faldón:17;Grosor del lavabo:2,1 cm:18;Fabricación:Estándar:19;Garantía:3 años:20";0;"new";0;0;0;0;1;"http://cdn.todomueblesdebano.com/raw/upload/v1668695027/products/b5ba301f-4be1-48d6-962a-70cde2f606a5/SANSA_FichaTecnica_1668695026.9467914.pdf";"";"";"";1;0;0;0;"140,136,137,138,139,163,143,159,154,164,162,161,155,142,144,160,158,157,156,149,167,165,146,148,145,168,166,147,170,169,197,150,172,152,171,151,153"
123;1;"Conjunto mueble de baño Royo Sansa";"13";535.0;1;"";1;123.0;19;"";"";"";"";"Royo Group";"Royo Group";"8414623359247";"";"";"";"120.0";"56.5";"46.0";0;"Entre 3 y 5 días";"";0;1;"";0;"both";"";"";"";"120 cm, 4 puertas, suspendido con lavabo Enzo de cerámica, Gran capacidad de almacenaje";"<p dir=ltr>Lo mejor para decorar el cuarto de baño es <strong>elegir piezas de marcas reconocidas, como Royo.</strong> Sus muebles de baño son de buena calidad, modernos, prácticos y con acabados impecables. </p><p dir=ltr><br></p><p dir=ltr>Por ejemplo, el conjunto de mueble de baño Sansa de <strong>4 puertas y 120 cm de ancho</strong> tendrá cabida en un baño grande y<strong> ofrecerá muchísimo espacio de almacenaje. </strong></p><p dir=ltr><br></p><p dir=ltr>Además, es un <a href=/muebles-de-bano/ rel=noopener noreferrer target=_blank>mueble de baño</a> con mucho estilo, con<strong> tirador integrado en el frente y personalizable</strong> (elige entre sus seis acabados, algunos arenados y otros brillantes). </p><p dir=ltr><br></p><p dir=ltr><strong>Incluye el lavabo cerámico Enzo</strong>, resistente al paso del tiempo y brillante. </p><p dir=ltr><br></p><p dir=ltr>Otras ventajas de este mueble de baño Sansa es que puedes elegirlo <strong>suspendido o bien añadirle unas patas de metal de diseño </strong>contemporáneo que no recargan visualmente el conjunto de baño. </p><p dir=ltr><br></p><p dir=ltr>Aprovecha para decorar esta zona del baño con una única compra, de la mano de una <strong>marca de gran reputación que te brinda un diseño atemporal. </strong></p>";"sansa,royo group,conjunto,muebles,baño,mueble,royo";"Mueble de baño con lavabo cerámico Sansa de 120 cm y cuatro cajones";"";"Decora de un plumazo tu cuarto de baño con el mueble de baño Sansa de cuatro puertas y 120 cm de ancho";"conjunto-mueble-de-bano-royo-sansa-1-suspendido-4-puertas-120-cm";"Disponible";"";1;"";"";1;"https://cdn.todomueblesdebano.com/image/upload/f_auto%2Cq_auto/v1/products/14df5655-10c5-4ec3-9df4-3a4e73038cf8/Sansa_120_2C2P_BlancoBrillov_Slim_Murano_Uri_1668687278.7250519,https://cdn.todomueblesdebano.com/image/upload/f_auto%2Cq_auto/v1/products/14df5655-10c5-4ec3-9df4-3a4e73038cf8/Enzo_copia_1669123069.6037939,https://cdn.todomueblesdebano.com/image/upload/f_auto%2Cq_auto/v1/products/14df5655-10c5-4ec3-9df4-3a4e73038cf8/sansa_4p_1669049473.3763306,https://cdn.todomueblesdebano.com/image/upload/f_auto%2Cq_auto/v1/products/14df5655-10c5-4ec3-9df4-3a4e73038cf8/Sansa_120_4P_Antracita_SlimDesplazado_1668687283.4681413,https://cdn.todomueblesdebano.com/image/upload/f_auto%2Cq_auto/v1/products/14df5655-10c5-4ec3-9df4-3a4e73038cf8/Sansa_120_4P_Blanco_SlimDesplazado_1668687286.861533,https://cdn.todomueblesdebano.com/image/upload/f_auto%2Cq_auto/v1/products/14df5655-10c5-4ec3-9df4-3a4e73038cf8/Sansa_120_4P_NogalArenado_Slim_1668687288.5120623,https://cdn.todomueblesdebano.com/image/upload/f_auto%2Cq_auto/v1/products/14df5655-10c5-4ec3-9df4-3a4e73038cf8/Sansa_120_4P_GrisArenado_Slim_1668687291.3499417";"";1;"Serie:Sansa:0;Tamaño de lavabo:Lavabo cerámico mide entre 1cm y 1,5 cm más que el mueble.:0;Ancho seleccionable estándar:120 cm:1;Fondo seleccionable estándar:46 cm:2;Alto seleccionable estándar:56.5 cm:3;Colocación:Suspendido:4;Tipos de cajones:Guías Hettich extracción total con cierre amortiguado:5;Material del mueble:Tablero de partículas de madera:6;Medida del grosor del lateral del mueble:16 mm:7;Medida del grosor del frente del mueble:16 mm:8;Tiradores - Muebles de baño:Uñero:9;Patas:Metálicas:10;Tipo de montaje - Muebles de baño:Montado (ensamblado de fábrica):11;Medidas del lavabo:1,5 cm mayor que el mueble (si el mueble mide 80x45 cm, el lavabo medirá 81,5x46,5 cm):12;Medidas de la poza:12 cm de profundidad:13;Nº de puertas:4:14;Material del lavabo:Cerámica:15;Grosor del lavabo:2,1 cm:19;Fabricación:Estándar:20;Garantía:3 años:21";0;"new";0;0;0;0;1;"http://cdn.todomueblesdebano.com/raw/upload/v1669034717/products/14df5655-10c5-4ec3-9df4-3a4e73038cf8/SANSA_FichaTecnica_1669034716.6747975.pdf";"";"";"";1;0;0;0;"138,137,139,140,136,157,159,162,144,164,143,155,163,161,154,156,158,142,160,167,168,147,149,165,146,166,145,148,197,170,169,150,152,172,151,153,171"
